{
  "runId": "run-20260831-015121-grok",
  "storiesImplemented": [
    "S1"
  ],
  "filesChanged": [
    "apps/connect/index.html",
    "apps/connect/styles.css"
  ],
  "componentsUsed": [
    "focx/Button/Destructive/Size=Large, Shape=Control, State=Default",
    "focx/Button/Destructive/Size=Large, Shape=Control, State=Disabled",
    "focx/Button/Destructive/Size=Large, Shape=Control, State=Focused",
    "focx/Button/Destructive/Size=Large, Shape=Control, State=Hover",
    "focx/Button/Destructive/Size=Large, Shape=Pill, State=Default",
    "focx/Button/Destructive/Size=Large, Shape=Pill, State=Disabled",
    "focx/Button/Destructive/Size=Large, Shape=Pill, State=Focused",
    "focx/Button/Destructive/Size=Large, Shape=Pill, State=Hover",
    "focx/Button/Destructive/Size=Medium, Shape=Control, State=Default",
    "focx/Button/Destructive/Size=Medium, Shape=Control, State=Disabled",
    "focx/Button/Destructive/Size=Medium, Shape=Control, State=Focused",
    "focx/Button/Destructive/Size=Medium, Shape=Control, State=Hover",
    "focx/Button/Destructive/Size=Medium, Shape=Pill, State=Default",
    "focx/Button/Destructive/Size=Medium, Shape=Pill, State=Disabled",
    "focx/Button/Destructive/Size=Medium, Shape=Pill, State=Focused",
    "focx/Button/Destructive/Size=Medium, Shape=Pill, State=Hover",
    "focx/Button/Destructive/Size=Small, Shape=Control, State=Default",
    "focx/Button/Destructive/Size=Small, Shape=Control, State=Disabled",
    "focx/Button/Destructive/Size=Small, Shape=Control, State=Focused",
    "focx/Button/Destructive/Size=Small, Shape=Control, State=Hover",
    "focx/Button/Destructive/Size=Small, Shape=Pill, State=Default",
    "focx/Button/Destructive/Size=Small, Shape=Pill, State=Disabled",
    "focx/Button/Destructive/Size=Small, Shape=Pill, State=Focused",
    "focx/Button/Destructive/Size=Small, Shape=Pill, State=Hover",
    "focx/Button/Primary/Size=Large, Shape=Control, State=Default",
    "focx/Button/Primary/Size=Large, Shape=Control, State=Disabled",
    "focx/Button/Primary/Size=Large, Shape=Control, State=Focused",
    "focx/Button/Primary/Size=Large, Shape=Control, State=Hover",
    "focx/Button/Primary/Size=Large, Shape=Pill, State=Default",
    "focx/Button/Primary/Size=Large, Shape=Pill, State=Disabled",
    "focx/Button/Primary/Size=Large, Shape=Pill, State=Focused",
    "focx/Button/Primary/Size=Large, Shape=Pill, State=Hover",
    "focx/Button/Primary/Size=Medium, Shape=Control, State=Default",
    "focx/Button/Primary/Size=Medium, Shape=Control, State=Disabled",
    "focx/Button/Primary/Size=Medium, Shape=Control, State=Focused",
    "focx/Button/Primary/Size=Medium, Shape=Control, State=Hover",
    "focx/Button/Primary/Size=Medium, Shape=Pill, State=Default",
    "focx/Button/Primary/Size=Medium, Shape=Pill, State=Disabled",
    "focx/Button/Primary/Size=Medium, Shape=Pill, State=Focused",
    "focx/Button/Primary/Size=Medium, Shape=Pill, State=Hover",
    "focx/Button/Primary/Size=Small, Shape=Control, State=Default",
    "focx/Button/Primary/Size=Small, Shape=Control, State=Disabled",
    "focx/Button/Primary/Size=Small, Shape=Control, State=Focused",
    "focx/Button/Primary/Size=Small, Shape=Control, State=Hover",
    "focx/Button/Primary/Size=Small, Shape=Pill, State=Default",
    "focx/Button/Primary/Size=Small, Shape=Pill, State=Disabled",
    "focx/Button/Primary/Size=Small, Shape=Pill, State=Focused",
    "focx/Button/Primary/Size=Small, Shape=Pill, State=Hover"
  ],
  "tokensUsed": [
    "focx.border.focus-ring",
    "focx.border.hairline",
    "focx.color.action-fill",
    "focx.color.action-fill-hover",
    "focx.color.action-fill-text",
    "focx.color.border-focus",
    "focx.color.border-subtle",
    "focx.color.status-danger",
    "focx.color.status-danger-fill",
    "focx.color.surface-1",
    "focx.color.surface-inverse",
    "focx.color.text-inverse",
    "focx.control.h-lg",
    "focx.control.h-md",
    "focx.control.h-sm",
    "focx.control.px-lg",
    "focx.control.px-md",
    "focx.control.px-sm",
    "focx.font.display",
    "focx.font.sans",
    "focx.radius.card",
    "focx.radius.control",
    "focx.radius.pill",
    "focx.space.3",
    "focx.style.brand-eyebrow",
    "focx.style.brand-hero-desktop",
    "focx.style.ui-caption",
    "focx.style.ui-subheading",
    "focx.text.body",
    "focx.text.brand-eyebrow",
    "focx.text.brand-hero",
    "focx.text.caption",
    "focx.text.label",
    "focx.text.subheading",
    "focx.weight.medium",
    "focx.weight.regular"
  ],
  "deviations": [],
  "driftCheckLocal": {
    "passed": true,
    "output": "drift-check: clean — no design drift detected."
  }
}
